title,rating,review,,,,,,,,,,,
"12th generation, perfect!",5.0 out of 5 stars,I switched from an i9 9900k and feel the evolution. The latest is always the best. I recommend buying it if you were hesitant; the satisfaction level is quite high.,,,,,,,,,,,
"Wow, what a beast!",5.0 out of 5 stars,"I upgraded from a 12500, which was already great, but this is on another level. Execution speed is amazing.",,,,,,,,,,,
Super happy,5.0 out of 5 stars,"Super happy, I’ve always had the i7 K series and expected worse performance because I came from an i7, but this is a step up.",,,,,,,,,,,
Magnificent,5.0 out of 5 stars,"Prompt delivery, perfect packaging, and reliable courier. Now I’m waiting for the technician to install the components.",,,,,,,,,,,
Works great,4.0 out of 5 stars,Costs a lot and I do not recommend to anyone with a tight budget like Â£900 if you have a tight budge,,,,,,,,,,,
Fast,5.0 out of 5 stars,"New format, but great. The problem is Windows 11, not sure when it will take off.",,,,,,,,,,,
15 years old Intel,4.0 out of 5 stars,"Intel has been leading since Slot 1. If it's the same price range, I would still consider AMD. Also, CPU sockets have changed to AM5, and AM4 motherboards are now more expensive. Even high-end Gigabyte motherboards are imported from the US.",,,,,,,,,,,
Fast and reliable,5.0 out of 5 stars,A CPU that I have been using for more than a year and will continue to use for the next few years.,,,,,,,,,,,
Intel,5.0 out of 5 stars,"Matches the photo and description. Superb packaging, very correct product.",,,,,,,,,,,
Incredible performance - outstanding value for money,5.0 out of 5 stars,"What Intel delivers with the 12th generation is almost unbelievable. After AMD's recent success, Intel has really stepped up.",,,,,,,,,,,
Good processor with a bad cooler,3.0 out of 5 stars,Before buying keep in mind that you might need a good cooler. I bought Noctua D15 which is very good,,,,,,,,,,,
"Almost perfect, only for the price",4.0 out of 5 stars,"Almost perfect, only the price is a bit high.",,,,,,,,,,,
Powerful and efficient.,5.0 out of 5 stars,This CPU is almost as powerful as the K model (only 2-5% difference) and easier to manage thermally.,,,,,,,,,,,
This Intel CPU is excellent,5.0 out of 5 stars,"I recently switched from using Ryzen CPUs. Considering the benchmarks, I replaced my existing Intel CPU with this one. The performance is truly impressive. The Windows boot speed alone is remarkable.",,,,,,,,,,,
Everything okay,4.0 out of 5 stars,ottimo prodotto silenziosissimo,,,,,,,,,,,
i7 (8620) exchange,5.0 out of 5 stars,"FPS increased from 100-150 to 130-243 with low graphics settings on black sand. Although there is little difference between high graphics and the same 2070, the stability is much better. I'm glad I made this purchase.",,,,,,,,,,,
Uses only 60w and is very powerful Intel Core.,5.0 out of 5 stars,One of the best computer processor.,,,,,,,,,,,
Best benchmark by far,5.0 out of 5 stars,Unbeatable quality-price ratio! The best if you want to spend the right amount without compromising.,,,,,,,,,,,
Meets expectations,5.0 out of 5 stars,"Works well, but the stock cooler doesn’t cool enough, so you need to buy a liquid cooling system.",,,,,,,,,,,
Very performant,5.0 out of 5 stars,"Bought to replace an i9-9900, very efficient.",,,,,,,,,,,
Perfect,5.0 out of 5 stars,Perfect for a good workstation and more.,,,,,,,,,,,
"Ideal as an upgrade for older computers, but will only operate in specific boards.",4.0 out of 5 stars,Would be useful to specify which boards it will work with as plug and play no longer exist.,,,,,,,,,,,
Great for cards in the 3060 to 3080 power,4.0 out of 5 stars,It great if you're trying to make a mid-range PC but you could spent a little more and get the i5-12,,,,,,,,,,,
Good price,4.0 out of 5 stars,"I got it very cheap, but I don't know if I made a good choice, with a 3060 of 12 GB, I still have p",,,,,,,,,,,
Slightly damaged box,4.0 out of 5 stars,"The delivery went well, on time, but the cardboard box was slightly damaged",,,,,,,,,,,
Very good 6 core,4.0 out of 5 stars,I love this CPU and its price tag. It can handle the newest games well and works quite well for graphics,,,,,,,,,,,
Excellent but watch out for temperatures if using the stock fan provided.,4.0 out of 5 stars,"This processor, without integrated video card or overclocking capability, is an excellent choice for",,,,,,,,,,,
Intel Cost Benefit,4.0 out of 5 stars,Best value for money from Intel for work,,,,,,,,,,,
Absolutely thrilled Gaming for little money ??,4.0 out of 5 stars,"I am absolutely thrilled with the CPU. For the price, there is nothing to complain about in terms of gaming",,,,,,,,,,,
Cooler,4.0 out of 5 stars,"The CPU works excellently, exactly as it should. Is it possible that the heatsink",,,,,,,,,,,
"Excellent processor, less than excellent cooler.",4.0 out of 5 stars,"Purchased during Prime Day for 150€, this processor has 6 cores and 12 threads that",,,,,,,,,,,
Excellent,4.0 out of 5 stars,Good processor paired with a 3070,,,,,,,,,,,
Quality,4.0 out of 5 stars,it's okay,,,,,,,,,,,
Correct,4.0 out of 5 stars,It is an average processor with expected performance. Delivered sealed and correctly (I put it,,,,,,,,,,,
No integrated graphics card,4.0 out of 5 stars,"Like all models ending with F, this processor does not have a graphics card. Up to you to",,,,,,,,,,,
Very good,4.0 out of 5 stars,"For 2023, this item is still in the mid-high range and will be for a few more years. Very",,,,,,,,,,,
Not bad!,4.0 out of 5 stars,"Not a bad processor, arrived quickly with excellent packaging.",,,,,,,,,,,
Cheap but efficient,4.0 out of 5 stars,The characteristics of this processor are not quite those of the 12th generation core i series,,,,,,,,,,,
Intel Core i5-12400F - 12th generation desktop processor,4.0 out of 5 stars,"Good processor even for gaming, doesn't heat up excessively and has good performance! The cost",,,,,,,,,,,
A simple bubble envelope for packaging.,4.0 out of 5 stars,"Having ordered this CPU second-hand with a 12€ discount on the new price, I received the processor",,,,,,,,,,,
Good value for money,4.0 out of 5 stars,"In terms of heating, it's not bad, and performance is good as well.",,,,,,,,,,,
I5 12400F,4.0 out of 5 stars,I created a new PC with this processor which suits my use well and I bought it,,,,,,,,,,,
Good Processor,4.0 out of 5 stars,Good processor,,,,,,,,,,,
Good performance,5.0 out of 5 stars,I am not a gamer but like to keep reasonably up to date and this intel cpu fits the bill for me. Its,,,,,,,,,,,
This is the PERFECT processor/best value for basic productive work!,5.0 out of 5 stars,This is the PERFECT processor/best value for basic productive work! How many of you just need a fast processor for standard home/office work? Buy this and call it a day.,,,,,,,,,,,
Great CPU,5.0 out of 5 stars,Great CPU. Works great out the box and super quiet cooler.,,,,,,,,,,,
Excellent performance/price ratio,5.0 out of 5 stars,Excellent value for money. Bought this processor to put in a desktop PC. The performance is outstanding.,,,,,,,,,,,
It is what it is,5.0 out of 5 stars,"Great CPU. Ideal for when you have a tight budget, it has good power for basic tasks and games.",,,,,,,,,,,
Good quality price,5.0 out of 5 stars,Impressive little beast. I have an i7-10700K. It beats the 10700k in Single-Core performance (I'm amazed).,,,,,,,,,,,
Good product,5.0 out of 5 stars,Functioning well up to March 2024. Working well up to March 2024.,,,,,,,,,,,
Impressive little beast,5.0 out of 5 stars,"Very good. Came in early, box damaged but luckily CPU was in good condition. Used to update BIOS on H670 board.",,,,,,,,,,,
Still working well until March 2024,5.0 out of 5 stars,Satisfied. Good product to start building a basic computer.,,,,,,,,,,,
Very good,5.0 out of 5 stars,Used to be an i7. Great for simple applications like displaying video on multiple screens or running lightweight programs.,,,,,,,,,,,
Satisfied,5.0 out of 5 stars,Not too expensive. I picked it up for $120 on sale. That's a good price. It works great.,,,,,,,,,,,
"In the past, this would have been an i7",5.0 out of 5 stars,"Great for what it is designed for. It's an i3, so don't expect i9 performance. With that said, I am using it in a custom-built NAS running.",,,,,,,,,,,
Not too expensive,5.0 out of 5 stars,Amazing little CPU. Strong single core. Decent multicore. Perfect for day-to-day use like browsing and MS Office.,,,,,,,,,,,
Great for what it is designed for,5.0 out of 5 stars,"Very good processor for domestic use for durability over time, however, it runs many heavy programs.",,,,,,,,,,,
Excellent,5.0 out of 5 stars,Very good value for money. Purchased in June 2022 and currently it's an excellent value for money (the best in.,,,,,,,,,,,
Profitable,5.0 out of 5 stars,"Good product for starting to build a basic computer. Works well, good condition, original without any issues. Good performance.",,,,,,,,,,,
Great little CPU,5.0 out of 5 stars,Good value. Good for 4K TV at 60HZ UHD 730 built-in graphics. My Son uses it for gaming with RTX 2070 8GB.,,,,,,,,,,,
Very fast processor,5.0 out of 5 stars,Great power on a budget. I've built 3 computers for clients on a budget using this CPU. Its power per dollar is great.,,,,,,,,,,,
Very good quality-price ratio,5.0 out of 5 stars,"It's amazing how far i3s have come! Compared to the i3 of just a few generations ago, it's amazing how far these mid-entry-level CPUs have.",,,,,,,,,,,
Good original product,5.0 out of 5 stars,"Rentable. Good processor. The advantage of entry-level like this is that it consumes less, when it is not used.",,,,,,,,,,,
Broken cooler fan,3.0 out of 5 stars,"The processor is reliable, though there are slight packaging concerns.",,,,,,,,,,,
Do NOT use the stock cooler!,3.0 out of 5 stars,"It smoothly handles daily tasks, with added security features as a notable advantage.",,,,,,,,,,,
Amazing CPU but not the fan....,3.0 out of 5 stars,"Connectivity options have been updated, though occasional compatibility issues may arise.",,,,,,,,,,,
"Good processor, bad cooler",3.0 out of 5 stars,"While suitable for general use, there are more specialized options for gamers.",,,,,,,,,,,
Inadmissible in a simple paper envelope,3.0 out of 5 stars,"Moreover, the processor efficiently manages power, though more customization options could enhance user experience.",,,,,,,,,,,
Inadequate packaging,3.0 out of 5 stars,"It's a commendable choice, especially given its competitive pricing.",,,,,,,,,,,
Good but not excellent,3.0 out of 5 stars,Overheating issues may occur with prolonged use.,,,,,,,,,,,
Very good price-performance ratio,3.0 out of 5 stars,"Priced reasonably, but other options might offer better features.",,,,,,,,,,,
Poor cooler,3.0 out of 5 stars,Battery life could be improved.,,,,,,,,,,,
Seal damaged,3.0 out of 5 stars,"It effectively manages multiple tasks, although it lacks groundbreaking features.",,,,,,,,,,,
"Good, fulfills its role",3.0 out of 5 stars,This is a less desirable version of the i5-1 with earlier stepping.,,,,,,,,,,,
Processor I5,3.0 out of 5 stars,"Although I bought it at a time of limited stock, it was available.",,,,,,,,,,,
Overheating,3.0 out of 5 stars,"The seal was broken on the box, though the product seems intact.",,,,,,,,,,,
I expected more,3.0 out of 5 stars,It arrived with a battered box.,,,,,,,,,,,
"Stock cooler is worthless, and Amazon EU sent me an open box",3.0 out of 5 stars,"Integrated graphics have been improved, though high-end gaming is still a challenge.",,,,,,,,,,,
Ineffective fan,3.0 out of 5 stars,"It performs smoothly in basic applications, though resource-heavy software may pose challenges.",,,,,,,,,,,
Good processor BUT,3.0 out of 5 stars,"Enhanced security features are beneficial, but there may be a slight performance impact.",,,,,,,,,,,
Box very damaged,3.0 out of 5 stars,"Multitasking is handled efficiently, but there's room for improvement.",,,,,,,,,,,
Poor delivery,3.0 out of 5 stars,"Performance is responsive, but thermal limitations may hinder it under heavy workloads.",,,,,,,,,,,
Very good product but a few issues,3.0 out of 5 stars,"Build quality is solid, but longevity concerns linger.",,,,,,,,,,,
I thought it was new but it wasn't haha,3.0 out of 5 stars,"Connectivity options have been improved, but there may still be compatibility issues.",,,,,,,,,,,
"Purchased processor is defective, struggling",3.0 out of 5 stars,"Power management is efficient, though user customization is lacking.",,,,,,,,,,,
Does not update if you already had a 10th gen i3 or similar,3.0 out of 5 stars,"Suitable for general use, though not ideal for gaming enthusiasts.",,,,,,,,,,,
Fan blade broke,3.0 out of 5 stars,"Security features are a plus, though performance may be slightly affected.",,,,,,,,,,,
Is the CPU used?,3.0 out of 5 stars,Overheating may occur with prolonged use.,,,,,,,,,,,
Sent something damaged inside the box,3.0 out of 5 stars,"Priced competitively, though other options may offer better value.",,,,,,,,,,,
Package damaged,3.0 out of 5 stars,Battery life could be optimized for longer usage.,,,,,,,,,,,
"Nice processor, but delivery is a shame",3.0 out of 5 stars,"It handles multiple tasks well, though innovation could be improved.",,,,,,,,,,,
Ventilation,3.0 out of 5 stars,"The CPU is perfect and amazing, I'm not going to lie about that, and it works as expected.",,,,,,,,,,,
Faulty CPU-not Intel's fault,3.0 out of 5 stars,I can't understand how such a serious company like Intel can provide a processor with a broken cooler fan blade.,,,,,,,,,,,
Powerful chip! (Intel),3.0 out of 5 stars,"Very good product quality-price ratio at the moment, but I would like to point out that Amazon sends c",,,,,,,,,,,
Not much better than 5600X in gaming performance despite being newer,3.0 out of 5 stars,Seal damaged!,,,,,,,,,,,
Don't trust UserBenchmark,3.0 out of 5 stars,"I bought thinking about swapping it out later for a 14600k, when it gets cheaper, since Intel allows",,,,,,,,,,,
Please advertise under the main heading that CPU Cooler is NOT Included!!,3.0 out of 5 stars,"Second-hand product but defective, pixelation",,,,,,,,,,,
Supposed to be new but...,3.0 out of 5 stars,The heatsink is rotten. My PC overheated just surfing the net to do the install,,,,,,,,,,,
Bad packaging,3.0 out of 5 stars,It arrived with the stock cooler dirty with the thermal paste touched,,,,,,,,,,,
Showed up looking ROUGH,3.0 out of 5 stars,"Delivery pepper, thermal paste and poor quality cooler.",,,,,,,,,,,
Arrived with scratches on CPU and CPU box that had seen better days,3.0 out of 5 stars,"Obviously, the processor came out months ago and hasn't been used much, it's like new in its box with the cal",,,,,,,,,,,
Feels like a retake on the 7th gen processors,3.0 out of 5 stars,Overall CPU looks to work good still in BIOS but came to realize one of the CPU fan blades broke and,,,,,,,,,,,
Buyer Beware,3.0 out of 5 stars,I didn't ask if it had a fan and then reviewing the post I saw that it is not specified in n,,,,,,,,,,,
Not worth the money,3.0 out of 5 stars,"Fast and effective processor. Was delivered by DPD who jammed this through the letterbox, crushing th",,,,,,,,,,,
Good CPU,3.0 out of 5 stars,"It's a great CPU. The packaging by Amazon, in shipping it, is awful. Nothing like getting a squashed CP",,,,,,,,,,,
"Things are good, but I'm not happy",3.0 out of 5 stars,It's a powerful chip that suits 99% of the population... hard gamers included!,,,,,,,,,,,
High temperature.,3.0 out of 5 stars,it has more cores which helps in some games but the lack of cache is killing it,,,,,,,,,,,
It doesn't come with the CPU Fan,3.0 out of 5 stars,UserBenchmark favors Intel for some reason. They would have you believe the 12600k is around 20% bet,,,,,,,,,,,
This is NOT the correct part number.,3.0 out of 5 stars,I am grading the main heading at the top of the page that does not let the consumer know a cooler is,,,,,,,,,,,
Just okay for light work.,3.0 out of 5 stars,Thanks Amazon/Intel for shipping a faulty CPU then proceed to try to make me wait a week except I co,,,,,,,,,,,
Good... ðŸ‘,3.0 out of 5 stars,No stock cooler. Extremely annoying.,,,,,,,,,,,
Opened box?,3.0 out of 5 stars,The product arrived in a damaged box and the chip was loose inside the box having been freed from it,,,,,,,,,,,
May 3rd,3.0 out of 5 stars,Overall CPU looks to work good still in BIOS but came to realize one of the CPU fan blades broke and,,,,,,,,,,,
Packaging damaged and fan damaged,3.0 out of 5 stars,I saw the imprint of poorly whipped off thermal paste on my chip and if ur paying new prices for a u,,,,,,,,,,,
"Improved Graphics, Still Not for Gaming",3.0 out of 5 stars,"The box was damaged upon delivery, so I returned it as is, sorry, I should have clarified. The box is important!",,,,,,,,,,,
"Smooth Basic Use, Struggles with Demands",3.0 out of 5 stars,"Although cpu box was sealed, package was dented and fractured. Yet to install the cpu",,,,,,,,,,,
Security Features with Performance Trade-off,3.0 out of 5 stars,"Fast and effective processor.Was delivered by DPD who jammed this through the letterbox, crushing th",,,,,,,,,,,
"Efficient Multitasking, Lack of Innovation",3.0 out of 5 stars,"I didn't ask if it came with a fan and then, upon reviewing the publication, I saw that it is not specified.",,,,,,,,,,,
Snappy but Heat-Limited Performance,3.0 out of 5 stars,Bought the i5 because it was on sale and unfortunately I could not get the system to boot. I made su,,,,,,,,,,,
"Solid Build, Longevity Concerns",3.0 out of 5 stars,It's a powerful chip that suits 99% of the population... hard gamers included!,,,,,,,,,,,
"Improved Connectivity, Persistent Issues",3.0 out of 5 stars,it has more cores which helps in some games but the lack of cache is killing it,,,,,,,,,,,
"Efficient Power Management, Limited Control",3.0 out of 5 stars,UserBenchmark favors Intel for some reason. They would have you believe the 12600k is around 20% bet,,,,,,,,,,,
"Good for General Use, Not for Gaming",3.0 out of 5 stars,I am grading the main heading at the top of the page that does not let the consumer know a cooler is,,,,,,,,,,,
Security vs. Performance,3.0 out of 5 stars,"Overall, it's great but for something with that much value, I would expect something better than a bag",,,,,,,,,,,
Overheating with Prolonged Use,3.0 out of 5 stars,"Look, this is a great processor. I use it in my build and I love it, but I bought one for my partner",,,,,,,,,,,
"Good Price, Better Alternatives",3.0 out of 5 stars,The CPU itself was in the plastic holder but had 4 vertical scratch lines as if someone had used it,,,,,,,,,,,
Battery Life Could Be Better,3.0 out of 5 stars,"Did not perform to expectations, basically a relabeled 7th gen. Returning to possibly see what the 1",,,,,,,,,,,
"Handles Multitasking, Lacks Innovation",3.0 out of 5 stars,"While I did indeed get the advertised product, I did NOT realize that there is no heatsink or fan i",,,,,,,,,,,
not very customizable,3.0 out of 5 stars,not very customizable,,,,,,,,,,,
Bottlenecking CPU,2.0 out of 5 stars,I put the Intel i5 in my MSI gaming motherboard and it doesn't work so I take it out and turns out it,,,,,,,,,,,
Was broken when purchased.,2.0 out of 5 stars,"The processor came with some corners bent, I am assembling it to see if it works. I have had dem",,,,,,,,,,,
The processor came with bent corners,2.0 out of 5 stars,"Not the best i5 version, returned the processor for i7 10 gen",,,,,,,,,,,
Not for gaming,2.0 out of 5 stars,"Used this to edit YouTube videos and it's really slow, I recommend getting an i7.",,,,,,,,,,,
I was unlucky,2.0 out of 5 stars,"It didn't work, but since I had already used it and stained it with thermal paste, I didn't want to return it.",,,,,,,,,,,
Cooler is junk - CPU is OK,2.0 out of 5 stars,"Pro: Package arrived early, packaged new. It was sent with an additional note reminding consumer to ",,,,,,,,,,,
Shipping is bad,2.0 out of 5 stars,"Bad packaing. Came with the poly mailer bag, doesn't look very good.",,,,,,,,,,,
It was not new as advertised.,2.0 out of 5 stars,"The i3 was supposed to be new but the package was clearly opened, also the fan did not come pre appl",,,,,,,,,,,
"There is no graphics board, and the screen is not displayed",2.0 out of 5 stars,"The PC broke and it was urgent for expenses, so I bought it cheaply, but although there are output terminals on the motherboard, considering, a graphics board is necessary, and a graphics board became mandatory. Although there was one at home before, there were output problems, and even after purchasing a new motherboard, it remained the same, and the old motherboard was the cause.",,,,,,,,,,,
Something wrong Something wrong,2.0 out of 5 stars,This motherboard will not work without an external video card. No video onboard.,,,,,,,,        ,,,
Delivered broken,1.0 out of 5 stars,"I just don't understand why I'm sent a broken CPU, it's just unnecessary.",,,,,,,,,,,
Arrived damaged?,1.0 out of 5 stars,"When I started up the new motherboard, is it supposed to have a red error LED on the CPU? Is that normal?",,,,,,,,,,,
Does not work,1.0 out of 5 stars,"I put together a gaming PC collecting parts over time as I had funds to purchase. Finally put it all together,",,,,,,,,,,,
Died after a couple of weeks of use,1.0 out of 5 stars,"Does not work. Fresh out the box and along with other brand new PC parts, after putting it together.",,,,,,,,,,,
Does not work at all,1.0 out of 5 stars,Bought in prime days brand new. Processor came dead on arrival. Amazon customer support refused to exchange it.,,,,,,,,,,,
"Dead on arrival, no help from Amazon",1.0 out of 5 stars,"Received used, discolored processor in a previously opened box. Evidence of thermal paste having been applied.",,,,,,,,,,,
Received Used Processor,1.0 out of 5 stars,"Upgraded from i7-6700 to 12700k, the performance is great! Works good with Linux and Windows. That's great!",,,,,,,,,,,
Many issues after 2 months... :\,1.0 out of 5 stars,"The box is broken, the CPU was easy to move in the box, probably already a returned product.",,,,,,,,,,,
Not satisfied,1.0 out of 5 stars,"They send you the KF model which costs less and doesn't have an integrated GPU. If you notice it, they make you an offer.",,,,,,,,,,,
WARNING BAD EXPERIENCE,1.0 out of 5 stars,"I recently purchased an i5 processor from Amazon, and unfortunately, it turned out to be defective.",,,,,,,,,,,
No Title,1.0 out of 5 stars,"I recently purchased an i5 processor from Amazon, and unfortunately, it turned out to be defective. ",,,,,,,,,,,
No Title,1.0 out of 5 stars,"Don't buy, they're selling used and defective products.",,,,,,,,,,,
Used CPU,1.0 out of 5 stars,"Received this today, CPU was pre-used and rattling around in the box in a sandwich bag. Thermal paste was everywhere.",,,,,,,,,,,
Waiting for refund,1.0 out of 5 stars,Still waiting for my refund after a faulty motherboard ruined the CPU and possibly my GPU. Amazon customer support is not helpful.,,,,,,,,,,,
Broken product,1.0 out of 5 stars,"I ordered the CPU, but when it arrived, a fan blade was broken.",,,,,,,,,,,
Broken fans,1.0 out of 5 stars,Came in with broken fans on delivery.,,,,,,,,,,,
Box arrived empty,1.0 out of 5 stars,Disgusting! I bought this for my son for Christmas!! The seal is broken and only part of the appliance is in the box.,,,,,,,,,,,
Arrived without the processor inside,1.0 out of 5 stars,"After one week, the whole box arrived with an internal fan but without a processor. A scandal.",,,,,,,,,,,
CPU that does not work,1.0 out of 5 stars,"I bought this processor new and was waiting to build my PC. Today, I received a message that it was already opened.",,,,,,,,,,,
Processor missing,1.0 out of 5 stars,"Unfortunately, the product packaging was opened and resealed, which seemed suspicious to me. And indeed, the product was used.",,,,,,,,,,,
Arrived without processor,1.0 out of 5 stars,"Beware to those who order second-hand, in my case, I didn't expect a nice box or anything, but at least that the product works.",,,,,,,,,,,
Precise machine arrived in simple paper packaging,1.0 out of 5 stars,"It came from Amazon delivery, in excessive packaging. It wasn't in a box but in a bag. It arrived damaged. Be careful when purchasing precision equipment like PC parts. Always buy with proper packaging.",,,,,,,,,,,
"Check for all the parts, as mine had some missing",1.0 out of 5 stars,"Lovely cooler, looks efficient. It should have a backplate in the box for it. Unfortunately, it shipped without one.",,,,,,,,,,,
Factory seal broken on CPU box [red flag?].,1.0 out of 5 stars,Arrival inspection finds the CPU box factory seal broken. All else seems somewhat normal although the product seems used.,,,,,,,,,,,
Bought new came with thermal paste on the pins on back,1.0 out of 5 stars,"I bought this product new, but it came used. It has thermal paste on the front and on the back of the processor.",,,,,,,,,,,
Do not buy it,1.0 out of 5 stars,"Intel secretly locked VCCSA so your RAM can't work stably if you turn on XMP. They claim it can work, but it doesn't.",,,,,,,,,,,
Bad cooler from intel,1.0 out of 5 stars,"The mounting system is bad, I did the diagonal push method but the last corner won't go in even with extra pressure.",,,,,,,,,,,
It's a USED processor.,1.0 out of 5 stars,"Received the product used, when the ad did not indicate that it was used. I feel disappointed.",,,,,,,,,,,
What the heck?,1.0 out of 5 stars,"Purchased on 7/29. Received on 7/30. I opened the Intel box and it only contained a used stock cooler, not the processor.",,,,,,,,,,,
Broken CPU,1.0 out of 5 stars,"Broken, just found out. Missed the return window by 3 days.",,,,,,,,,,,
