title,rating,review,,,,,,,,,,,
The best CPU I've owned so far. Rivaling even the 5900X! Intel is killing the game as of now.,5.0 out of 5 stars,"I upgraded to this CPU after some HEAVY research, asking Reddit (Both Intel and AMD subreddits), weighing in money VS performance gained. I have used AMD since I was a teen and started building computers. The conclusion is this: It is an amazing CPU, runs faster and cooler than my Ryzen 7 1700. The price AND performance VS AMD (Also including a board) was better than if I had went with a Ryzen 7 5800X.Some background information: I wanted to upgrade after receiving an Amazon gift card (I have never ordered computer parts from Amazon though). I upgraded from a Ryzen 7 1700, with an ASUS x370-f board. I really wanted to upgrade, and was sad also that Windows 11 did not support my CPU! I will give it to Microsoft for this, as it made A LOT of people upgrade their entire computers, all for basically the same OS as of now with newer looks, and not much done under the hood (EXCEPT for 12th gen Intel, so good news there too). Sadly, my old board STILL doesn't support the Ryzen 7 5000 series, and only the 3000 series (They are working on a BIOS apparently for the 5000 series, because of people who were in my shoes). I first almost ordered the Ryzen 7 3800XT, for $400! After a couple hours of research, asking, and thinking about it... I cancelled that order (Thankfully) and thought ""Well, if I am going to spend this much on upgrading my CPU, I might as well go all in/spend a little more for something better, as this may be my last big upgrade in this regard for awhile."" I was then going to get the Ryzen 7 5800X with an Asus board. There lied a problem of price, I could not find a board AND get that CPU still within my budget (At-least not a board that wasn't worse than the one I had in ways). I mentioned I had posted on the AMD subreddit, and even they suggested I go Intel (Intel is just killing it as of now, hands down, although I am sure AMD will retaliate). I ended up getting the MSI Z690-A DDR4 (I wish I had the money for DDR5 RAM, I would have went with the DDR5 version as it was basically the same price). I had A LOT of second thoughts on this board though, as it just didn't seem ""Premium"" as the one I had (I am going to do a whole review on it after this. I'll save my Pros & Cons for there.) This CPU also auto-clocks itself up or down depending on the load (Saw it clock down to 1GHz, although not for long, for example if not much processing power is warranted, which makes sense and I wish everything did). So if idling, it will clock down and save power/heat/and therefore longevity is increased. I absolutely love this CPU coming from AMD. Anyways...If you have a Corsair H100I RGB Platinum or similar cooler already: The included 1200 screws work just fine with the 1700 socket and this CPU, even though you are supposed to get the 1700 kit/screws for this CPU (Which I did, but they are taking FOREVER to ship, so I googled, and someone said using the 1200 screws will work just fine). I get better temps. than my Ryzen 7 1700. I can even overclock EVEN MORE but have no need, and no point.TL:DRUpgraded from: Ryzen 7 1700, Asus Rog Strix x370-f gaming.Upgraded to: i7-12700K, MSI Z690-A DDR4.Parts kept: 4x8GB 32GB DDR4 CL16 3000MHz RAM (With XMP, D.O.C.P), RTX 2070. The RAM works great with this CPU as well, although it TECHNICALLY (Latency wise, runs at 2T on Intel instead of 1T on AMD) runs slower than when on AMD (AMD's infinity fabric) but obviously whatever Intel is doing makes up for that, and therefore my RAM either runs faster/the same)Pros: It is an amazing CPU for price VS performance. The i5-12600K is good as well (I almost just went with it), and you would be fine going with it for gaming (As even it still has more cores technically than the Ryzen 7 5800X, it also beats the 5800X even though THIS CPU is supposed to be its comparison rival brother.) This CPU has cool temps on my Corsair H100I RGB Platinum cooler, and the P&E core structure are REALLY cool and fun to watch when doing tasks/gaming. It shipped fast!Cons: Literally none with the CPU itself. Just with shipping - It shipped really fast! Was here in 2-3 days after purchasing on here. The biggest complaint I have is Amazon's shipping (SO BE AWARE OF THIS) I have never ordered computer parts from Amazon, and have always used New-egg. They just left the CPU in my mail-box, and if it weren't for me looking at my camera's, and looking out for this part, it would have sat in the mail-box all day. My mail-box sadly is not very weather proof as well, and if it had been raining... It wouldn't have been good. Although it did come in a big box around it. The CPU also was jarred loose and flopping around in the box (Not held into the front window).I hope this review helps people!",,,,,,,,,,,
Alles gut so,5.0 out of 5 stars,Alles gut so,,,,,,,,,,,
Excellent cpu,5.0 out of 5 stars,Excellent cpu and great value,,,,,,,,,,,
EXCELENTE,5.0 out of 5 stars,"LLEGO EN PERFECTAS CONDICIONES, MUY RECOMENDABLE",,,,,,,,,,,
Still a great choice for gaming,5.0 out of 5 stars,"If you're not going next gen, this is your best option, great price and amazing performance both in gaming and productivity",,,,,,,,,,,
Exactly what was ordered,5.0 out of 5 stars,"Basic processor used from my home PC, does exactly what was requested and ordered",,,,,,,,,,,
Intel i7-12700K,5.0 out of 5 stars,Big upgrade from my 9 years old 5820K.,,,,,,,,,,,
Great processor,5.0 out of 5 stars,"For my needs, itâ€™s the perfect â€œbang for the buckâ€ balance between performance and price.",,,,,,,,,,,
i7  ï¼˜ï¼—ï¼ï¼ã‹ã‚‰ã®äº¤æ›,5.0 out of 5 stars,é»’ã„ç ‚æ¼ ç”»è³ªLOWè¨­å®šã®ï½†ï½ï½“ãŒ100ã€œ150â†’130ã€œ243ã¾ã§ä¸ŠãŒã£ãŸã‚‚ã¡ã‚ã‚“ã‚°ãƒ©ãƒœã¯åŒã˜2070sé«˜ç”»è³ªã ã¨å·®ã¯ç¸®ã¾ã‚‹ã‘ã©å®‰å®šæ€§ãŒé•ã†ã„ã„è²·ã„ç‰©ã‚’ã—ãŸã¨æ€ã†ã€‚,,,,,,,,,,,
Use only 60w and is very good and powerful Intel Core.,5.0 out of 5 stars,One of the best computer processor.,,,,,,,,,,,
Benchmark alla mano migliore di tutti,5.0 out of 5 stars,Rapporto qualitÃ  prezzo semplicemente imbattibile! Il migliore se vuoi spendere il giusto senza ipotecare casa!,,,,,,,,,,,
Cumple con lo esperado,5.0 out of 5 stars,Funciona bien aunque el ventilador de stock enfrÃ­a poco y hay que comprar refrigeraciÃ³n lÃ­quida si no quieres que se ponga a 100grados (en tareas muy exigentes claro),,,,,,,,,,,
tres performant,5.0 out of 5 stars,"achetÃ© pour remplacer un i9-9900, trÃ¨s efficace.",,,,,,,,,,,
Parfait,5.0 out of 5 stars,Parfait pour une bonne workstation et plus si affinitÃ©,,,,,,,,,,,
Wenig Stromverbrauch,5.0 out of 5 stars,Beste Entscheidung fÃ¼r Virtualisierung.,,,,,,,,,,,
Super performante,5.0 out of 5 stars,"CPU molto versatile essendo che la utilizzo per varie funzioni, ma sotto sforzo durante il gaming risulta prestante e stabile.Incluso dissipatore.",,,,,,,,,,,
Eccezionale,5.0 out of 5 stars,Ho ricevuto il prodotto prima del previsto ed Ã¨ tutto eccezionale! Consiglio l'acquisto.,,,,,,,,,,,
"Nice processor, but needs an external cooler",5.0 out of 5 stars,"I have had this CPU for a few weeks now, I am impressed with its performance. However, it definitely needs a a better cooler. The one provided in the box is not sufficient even for single-threaded workloads. Though I guess this is expected ...",,,,,,,,,,,
"stable, fast, and smooth.",5.0 out of 5 stars,"This is my first intel build coming from past AMD builds (Ryzen, FX, Athlon, Phenom). I am nowhere near a hardware engineer level to distinguish or feel the differences in performances but for the average gamer and turning on this CPU with instructions followed, this chip is very well to be worth it and confident to be future proof until at least 2026. I overclocked this via the motherboard/bios settings and it stays cool with a $30 fan cooler. (don't get a super cheap or small cpu cooler otherwise would risk overheating) Just follow installation instructions carefully the chip is delicate. windows experience rating is a 9.7 so that says it all. If you have the extra 50-60$ go with the i9 i should have done that. AMD seems to be all the hype but I see why Intel won't be going away anytime soon this is a solid chip.",,,,,,,,,,,
Classica CPU Intel fascia media da gaming e produttivitÃ ,5.0 out of 5 stars,Classica CPU Intel di fascia media da gaming e produttivitÃ . Packaging perfetto e nessun problema di installazione.Viste le ultime uscite di CPU intel di 14^ generazione il prezzo dovrebbe assestarsi intorno ai 280-300 â‚¬ per diventare un best buy,,,,,,,,,,,
Ras,5.0 out of 5 stars,Livraison relativement rapide et processeur livrÃ© neuf,,,,,,,,,,,
Ã©fficace,5.0 out of 5 stars,performent,,,,,,,,,,,
Va bene!,5.0 out of 5 stars,Tutto Ok,,,,,,,,,,,
Is good,5.0 out of 5 stars,Intel CPU is good,,,,,,,,,,,
Perfecto,5.0 out of 5 stars,Funciona perfectamente. Noto la diferencia ya que vengo de una i5 octava generacion. Y ya con una GPU 4070 ti tendrÃ© mas experiencia al respecto.,,,,,,,,,,,
Intel Core i7-12700K Desktop Processor 12 (8P+4E) Cores up to 5.0 GHz Unlocked LGA1700 600 Serie,5.0 out of 5 stars,Good.......,,,,,,,,,,,
Parfait,5.0 out of 5 stars,Rien Ã  redire et il ne chauffe pas (28C au repos) mÃªme sans water cooling,,,,,,,,,,,
Great cpu for gaming and productivity,5.0 out of 5 stars,Got it as an upgrade over my old 8700k and this is a huge upgrade. I do recommend installing a contact frame such as the thermalright for this CPU,,,,,,,,,,,
CPU I7 12700,5.0 out of 5 stars,OTTIMO PROCESSORE VELOCISSIMO,,,,,,,,,,,
Ã¨ sempre lui,5.0 out of 5 stars,i7 Ã¨ sempre i7,,,,,,,,,,,
Intel Core i7-12700,5.0 out of 5 stars,Che si puÃ² dire di un processore. mi serviva per una build. PiÃ¹ che soddisfatto. Usato per SHIPCONSTRUCTOR,,,,,,,,,,,
Processore Top,5.0 out of 5 stars,"Acquistato di recente questo processore di 12th gen devo dire che Ã© una bomba, sia per quanto riguarda il Gaming che per la gestione di altri programmi. A differenza dell' I9 scalda la metÃ .. Insomma stra consiglio.",,,,,,,,,,,
CPU molto performante,5.0 out of 5 stars,"CPU molto versatile puoi fare di tutto dal lavoro al gaming senza problemi (Consiglio di sostituire il dissipatore stock rumoroso sotto sforzo, magari con un impianto a liquido)",,,,,,,,,,,
Ottimo processore,5.0 out of 5 stars,"Ottimo e veloce processore, testato e provato, per il momento non mi ha dato problemi",,,,,,,,,,,
Tanti core a un prezzo ottimo,5.0 out of 5 stars,"Spinge come un cinghiale, ma in certi scenari scalda come un animale",,,,,,,,,,,
Best cpu,5.0 out of 5 stars,Ottima cpu di fascia alta x chi oltre al gaming vuole qualcosa in piÃ¹,,,,,,,,,,,
Ottimo processore,5.0 out of 5 stars,"Processore ottimo, nessun tipo di rumore. Arrivato in un ottima confezione con dissipatore ad aria. Rapporto qualitÃ  prezzo ottimo.",,,,,,,,,,,
De la puissance brut !,5.0 out of 5 stars,SupÃ©rieur au i5 13500 de 15%,,,,,,,,,,,
Rapido.,5.0 out of 5 stars,"Un procesador rÃ¡pido y eficiente, en conjunto con una buena tarjeta grafica, es una maravilla",,,,,,,,,,,
.,5.0 out of 5 stars,super,,,,,,,,,,,
Fast and nice. Good shopping experience for me.,5.0 out of 5 stars,Fast and nice. Good shopping experience for me.,,,,,,,,,,,
Processeur i7,5.0 out of 5 stars,Fait parfaitement son taff,,,,,,,,,,,
Intel i7-12700k,5.0 out of 5 stars,I heard good things about this cpu and went for it. Budget friendly and a very good cpu!,,,,,,,,,,,
"Fast! Very Fast , performs better than expected.",5.0 out of 5 stars,"This is my first 1700 socket processor, so I can't really give it a proper speed review , however it was very simple to install , just be very very careful !!",,,,,,,,,,,
Parfait,5.0 out of 5 stars,ArrivÃ© dans les temps et le produit est trÃ¨s performant lâ€™un des meilleurs processeur du moment parfait pour les jeux dâ€™aujourdâ€™hui qui sont souvent cpu-bound !,,,,,,,,,,,
"Fast, great performance, smooth multitasking",5.0 out of 5 stars,"I upgraded from the i7 6700k to the i3 13100 and saw a great performance increase. I was eager to test ddr5. However,  I also wanted to experiment with 6+ core processors. Fortunately I found this i7 12700k when the price dropped to 275. I wasn't sure if it would be a big increase from the i3 and the i7 6700k. But the i7 12700k is a ferocious beast that has crushed all tasks I've given it and brought immesnse life back to my RTX 2060 super and it stays cools & fluent.Z790 auros elite axI7 12700k overclocked pcores 5.2 ghz ecores 4.0 ghz 50-65Â°C during multi intensive tasks and games for long periods of timeRTX 2060 super 8bg ddr6Corsair vengeance 6000mhz ddr5Cyberpunk 60-65 fps 1080 ultra+psycho with medium ray tracing with a low of 59Starfield 30- 40 1080p fps high settings the devs need to optimize thoughHorizon zero Dawn 80-85 fps 1080 ultraShreds through video editing and music editing all at onceAmazing at multitaskingPowerfulFastCan be placed in ddr4 mobos and ddr5 mobos",,,,,,,,,,,
Excelente producto.,5.0 out of 5 stars,"Un muy buen producto. Lo ocupo para desarrollo de software y la verdad es muy rapida la computadora, aun cuando ocupo docker.",,,,,,,,,,,
Molto soddisfatto,5.0 out of 5 stars,Ottimo,,,,,,,,,,,
Gran bel salto,5.0 out of 5 stars,"Finalmente un bel passo avanti da parte di Intel. Il processore va davvero bene, parco nei consumi, potente sia in single che in multi core e non scalda eccessivamente.Se lo state guardando qua probabilmente avrete giÃ  visto innumerevoli benchmark sul web quindi inutile postarli.Come tutti i componenti di un pc va contestualizzato rispetto allâ€™uso che una persona ne deve fare. Personalmente ne consiglio lâ€™acquisto",,,,,,,,,,,
Nada,5.0 out of 5 stars,No comento,,,,,,,,,,,
Arrivato integro,5.0 out of 5 stars,Venditore serio e consigliato,,,,,,,,,,,
trÃ¨s bon processeur,5.0 out of 5 stars,"je quitte un i7 6700k (6eme gÃ©n) qui avait fait son taf pour le nouveau i7 12700k et la c'est le jour et la nuit.couplÃ© Ã  une CM ASUS ROG STRIX Z690 et au refroidissement ROG RYUJIN II 360.il rÃ©pond Ã  mes attentes, j'ai hÃ©sitÃ© entre le i5 12600k et celui ci, je ne regrette pas mon achat.cotÃ© AMAZON, rien a dire commandÃ© le mardi pour une rÃ©ception 48h aprÃ¨s, le jeudi.",,,,,,,,,,,
Solid I7 Chip,5.0 out of 5 stars,"Just be sure to match up the chip correctly on the socket (one corner has a triangle cutout)Easy to install.Runs smooth and is not a power hog or a supernova in terms of heat.Even at load, it performs well.Perfect for gaming, no issues in keeping up with GPU.",,,,,,,,,,,
quick and exactly as advertised,5.0 out of 5 stars,got it the next day as stated and was exactly as advertised. Yes would buy from again,,,,,,,,,,,
"Good performance, cheap price",5.0 out of 5 stars,"A great performance, cheap enough for the performance it gives. I got this for 210$ on BF. Recommend!",,,,,,,,,,,
Prodotto di grande qualitÃ ,5.0 out of 5 stars,"Prodotto di grande qualitÃ , pianificato l'acquisto per la configurazione di un nuovo pc. Molto soddisfatto su acquisto e  tempi di consegna",,,,,,,,,,,
i7 12700k,5.0 out of 5 stars,"Para mÃ­ el mejor de las Ãºltima tres generaciones de Intel, un TDP decente, no eh tenido problemas de temperaturas ni ningÃºn problema , lo recomiendo.",,,,,,,,,,,
Fonctionne parfaitement,5.0 out of 5 stars,"Pas de problÃ¨me au montage : j'ai montÃ© un ventirad noctua NHU12A : quand le proc travaille Ã  100%, il reste sous les 80Â°C. En fonctionnement normal, l'ensemble est silencieux. Attention si la CM marche Ã  la DDR5 : c'est 2 fois le prix de la DDR5.Le GPU fonctionne bien (traitement video) en attendant que les cartes graphiques reviennent Ã  des prix raisonnables.",,,,,,,,,,,
Good for its value,5.0 out of 5 stars,Good enough for this price range,,,,,,,,,,,
Microsoft Flight Simulator,5.0 out of 5 stars,"runs Microsoft Flight simulator on multiple 32"" screens beautifully.",,,,,,,,,,,
Perfect,5.0 out of 5 stars,Perfect,,,,,,,,,,,
Great product/Brand Intel i7 CPU,5.0 out of 5 stars,Great product/Brand Intel i7 CPU. I have been using the Intel brand CPU's and have been using the i7 and the K series since they were introduced. This seems to handle video processing and CAD/CAM projects quite well. I have always had great luck with Intel brand processors and will continue using them. Pretty good value for the cost.,,,,,,,,,,,
Awesome upgrade and great value,5.0 out of 5 stars,"Compared to the Coffee Lake generation I had been (willingly) stuck on for 4 years this is a massive leap. Before buying I was a bit skeptical since I'm not a fan of Intel's newer way of handling cores, but the first thing I tried when I got it was emulating PS3 games and right off the bat I saw compile times cut tenfold and stability at least doubled.The older CPUs from the 8th, 9th, and 10th gen are perfectly usable for most people so if you're on a budget maybe look on the used market for those. But if you really need something powerful this is a good option.",,,,,,,,,,,
Huge upgrade from 8th gen i5,5.0 out of 5 stars,Huge upgrade from 8th gen i5! paired it with the ASRock Z690 and 32g DDR4,,,,,,,,,,,
Ã“timo produto.,5.0 out of 5 stars,Usado no trabalho.,,,,,,,,,,,
Procesador para todos los usos,5.0 out of 5 stars,RecibÃ­ el producto con la prontitud del caso. Llego sellado y en una caja con otro producto. El funcionamiento es bueno y no se suele calentar mucho con un buen sistema de refrigeraciÃ³n por aire.,,,,,,,,,,,
No problems!,5.0 out of 5 stars,"At this time in the product life cycle, the 12th gen CPU is about half the cost of the 14th gen CPU.  It is more than fast enough for everything I do.  My major reason for upgrading was my old motherboard did not have TPM 2.0.  The CPU was easy to install, it is running between 36-37 degrees Celsius (though I admit I am not stressing it).  I am very happy with my purchase.",,,,,,,,,,,
Great price to preformance curve.,5.0 out of 5 stars,This appears to be the best option for intel at this price range. Works as advertised.,,,,,,,,,,,
A good product is worth recommending.,5.0 out of 5 stars,"This is a very good product, and there are no issues with its features and performance. The usage process is also very smooth, and there hasn't been any overheating so far.",,,,,,,,,,,
top notch CPU,5.0 out of 5 stars,It's a top-of-the-line CPU that will last for a long time. There's nothing to dislike about it.it replaced a 12 year 3770K!,,,,,,,,,,,
Intel Core i7-12700K Comment,5.0 out of 5 stars,"æˆ‘ç‰¹åƒ¹æ™‚è³¼è²·çš„ï¼Œä½¿ç”¨ä¸Šæ²’æœ‰ä»»ä½•çš„å•é¡Œï¼Œç‰©è¶…æ‰€å€¼ã€‚I purchased it at a special price, and I haven't encountered any issues in terms of usage. It offers great value for the money.",,,,,,,,,,,
Great for the price,5.0 out of 5 stars,If you're looking for an Intel cpu I would recommend this even though it is a couple years old now I belive its still the best intel cpu for gaming,,,,,,,,,,,
Todo bien,5.0 out of 5 stars,Excelente,,,,,,,,,,,
The genuine article,5.0 out of 5 stars,"Great cpu, would buy again.",,,,,,,,,,,
Llego en buen estado la caja y demas,5.0 out of 5 stars,"The media could not be loaded.
                



Ya vere como se comporta cuando haga mi ensamble",,,,,,,,,,,
Good value,5.0 out of 5 stars,"Went from a 9400f to this was a big different on gaming, i finally get the fully potencial of my gpu",,,,,,,,,,,
AMAZING VALUE!,5.0 out of 5 stars,"Wow what an incredible black Friday deal. Seriously, $211 is well worth it for the performance. I also purchased the 12600k for $153 which is another unbeatable deal offered this year at amazon. If you managed to get your hands on either one of you made the right choice.",,,,,,,,,,,
As Good as Specified!,5.0 out of 5 stars,This is a second purchase of core i7 12700. It works very well as expected.,,,,,,,,,,,
Intel has never let me down.,5.0 out of 5 stars,"I've installed a 10th gen 2x, 12th gen, and a 13th gen on my family's pc's. I've never had a problem.",,,,,,,,,,,
A good sweet spot for an over clocker,5.0 out of 5 stars,"for my limited budget, I bought it, While the 12700K isn't the top of the line, at least for me, it was more affordable and very performant. I've had good success overclocking it and actually undervolting  it to reduce temperatures!",,,,,,,,,,,
After 1 year is working perfectly,5.0 out of 5 stars,"Great CPU for multitasking, I don't know too much about CPU but this is great!",,,,,,,,,,,
Prior 12700k took a crap on under a year,5.0 out of 5 stars,"So far so good, but then that's what I said about the last one...  I'll check back in a year on this and hope it outlasts my prior CPU.As for the last one... it's Intel dropping the ball with their QC it seems.  Had an IMC function poorly and finally give up the ghost and refuse to post with more than one memory module installed.  Couldn't run any XMP profiles, and swapping the processor solved it (not a Mobo issue).Just watch for funky behavior when you buy this gen, and return it if *anything* seems even *remotely* off.",,,,,,,,,,,
It was Surprisingly Simple to Install.,5.0 out of 5 stars,"The heart of my PC build and wanted to have the ""K"" version with the Integrated Graphics... even though I was going to have a GPU anyways, it's a good backup if the GPU fails.Can't do a Pro and Con here as there is nothing much to report.It plays every game without bottlenecking my RTX 3070 and was a breeze to install (there is literally one way to install it. <You'd have to intentionally or forcibly install it wrong).Also, it runs surprisingly cool and doesn't act like an easy-bake oven in my Motherboard.",,,,,,,,,,,
Good CPU performance,5.0 out of 5 stars,"I got the CPU on sale and I would say the performance is great, my application is running smoothly and does not come into any problem for a year now.",,,,,,,,,,,
so good,5.0 out of 5 stars,"this thing is a workhorse! ive got mine clocked to 5.0GHz and it runs like a dream, keep in mind this unit will require a water pump air coolers are not enough!",,,,,,,,,,,
Great CPU,5.0 out of 5 stars,"Bought this for a new personal PC. My last was an i7 4790K build that got totaled out (crushed) during shipping. After building a new one on a z790i platform, the performance gain was stunning, completely night and day! I cannot say enough about this CPU, and would totally recommend this product!!",,,,,,,,,,,
Watch the price on this one,5.0 out of 5 stars,"The i7-12700K is in the top 5 for gaming CPUs right now. AMD is doing fairly well as of late but Intel has a solid performance lead with it's single core performance on newer generation chips.If you're on the fence and want a quick top 5 for overall gaming performance, it goes as follows:1. i9-13900k2. i7-13700k3. i9-12900k4. i5-13600k5. i7-12700kThis chip is no slouch though, it trades blows with the 13600K in some situations if overclocked but overclocking isn't really fair for comparison.In conclusion, if you're looking around this price point, check both this CPU and the 13600k. Pick whichever is cheaper. Higher end 12th gen Intel motherboards can be flashed in the BiOS to take 13th gen CPUs too, but do your research on those before going that route. This one will serve you well. :)",,,,,,,,,,,
Works Great!,5.0 out of 5 stars,"It's been roughly 6-7 years since I last build my gaming computer. Upgrading to this has been more than significant. As of this writing, I hope you've done your research the I7-12700k's price point and its competition. For this price point, it may be the top dog.Some things to consider before purchasing:1) Make sure you are purchasing a LGA 1700 motherboard. I went with the DDR4 motherboard because DDR5 is still at its infancy. The DDR5 ram may not be the best option for your buck right now. You'll be fine with DDR4.2) This CPU does consume a lot more power compared to its predecessor. Double check if your PSU will be enough. There are online resources that will help you calculate your PSU. It's always good to have a little overhead.3) Make sure your heatsink has retrofit screws that's compatible with this motherboard. You can purchase them separately. If you have a heatsink that's very old (<2016), it's more than likely it may not be compatible.Good luck!",,,,,,,,,,,
A better deal for most people vs. the i9,5.0 out of 5 stars,"I had been planning to hold off for Raptor Lake, but my Z370 mobo died, and I decided to go ahead and get an Alder Lake i7.  So far it's impressive.  It runs much cooler than my i9-9900k (mild OC) ( 59C-63C under a gaming load vs 75C+) but that could've been due to the my old AIO being in it's death throws for the past few months.  3DMark CPU score went up noticeably as well.  Overall, I'm pretty happy with it.  Haven't messed around with overclocking yet, but there doesn't seem to be as much headroom left as there used to be,  from what I've read 5.3 Ghz is about what you can expect.  The days of getting another 800Mhz - 1 Ghz+  over stock clocks out of a CPU are gone it seems.",,,,,,,,,,,
Great product,5.0 out of 5 stars,Great product,,,,,,,,,,,
Team Blue!,5.0 out of 5 stars,"Have been on team Blue for years now and coming off a 7XXX i5, this is a huge upgrade! Haven't looked into overclocking but having a K processor futureproofs me for that!",,,,,,,,,,,
Legit,5.0 out of 5 stars,"Paired it with an ASUS MOBO and a Lian Li 360mm AIO.Runs cool, no performance issues, and no bottlenecks for the gaming i use it for.",,,,,,,,,,,
