title,rating,review,,,,,,,,,,,
Schneller als  Ã¤ltere Core-i7-Prozessoren aus LGA 2011-3,5.0 out of 5 stars,"Unglaubliche Geschwindigkeit und  spart auch Energie bei office Anwendungen!Schneller als einige Jahre Ã¤ltere Core-i7-Prozessoren, die damals 700 Euro kosteten. Ideal auch zum Spielen, spielt alle neuen Spiele in FULL HD.",,,,,,,,,,,
Parfait,5.0 out of 5 stars,Fait bien le travail pourquoi il a Ã©tÃ© programmÃ©,,,,,,,,,,,
Bueno,5.0 out of 5 stars,"Muy fluido, con el entorno adecuado. Excelente relaciÃ³n precio prestaciones.",,,,,,,,,,,
Parfait pour du gaming mid-range,5.0 out of 5 stars,"Le processeur Intel Core i3-12100F est idÃ©al pour du gaming midrange en raison de son excellent rapport performances/prix. Avec ses quatre cÅ“urs et huit threads, il offre une bonne puissance de traitement pour exÃ©cuter les jeux modernes sans problÃ¨me. De plus, sa frÃ©quence de base Ã©levÃ©e et sa prise en charge de la mÃ©moire DDR4 jusqu'Ã  3200 MHz contribuent Ã  des performances fluides dans la plupart des jeux. En combinant ce processeur avec une carte graphique de milieu de gamme, vous pouvez obtenir une expÃ©rience de jeu trÃ¨s satisfaisante sans avoir Ã  dÃ©penser une fortune sur le matÃ©riel.",,,,,,,,,,,
Still the best value budget CPU in 2023,5.0 out of 5 stars,"Works great out of the box, stock cooler is much better than previous generations, overall value is still the best in 2023",,,,,,,,,,,
Funciona muy bien,5.0 out of 5 stars,Jala muy bien el procesador,,,,,,,,,,,
Muito bom eu aprovo,5.0 out of 5 stars,O vendedor estÃ¡ de parabÃ©ns eu amei,,,,,,,,,,,
Beast of a processor,5.0 out of 5 stars,Love this little bargain of a chip.,,,,,,,,,,,
Buon compromesso sia per qualitÃ  e prezzo.,5.0 out of 5 stars,"Il processore Intel Core i3-12100F Ã¨ una scelta interessante per chi cerca prestazioni solide senza spendere troppo. Ecco alcuni dettagli sulla CPU:Prestazioni: Il Core i3-12100F Ã¨ un chip quad-core che puÃ² gestire i giochi se abbinato a una GPU dedicata. Ãˆ piÃ¹ adatto per attivitÃ  come la navigazione su internet, il lavoro, lo studio e le videochiamate. Nonostante sia una soluzione economica, offre prestazioni affidabili.Efficienza energetica: Questo processore Ã¨ progettato per offrire un buon equilibrio tra potenza e consumo energetico. Anche alzando i limiti, si vedranno miglioramenti modesti ma notevoli nelle prestazioni, senza compromettere lâ€™efficienza energeticaPrezzo accessibile: Con un costo di circa 100-110 euro, lâ€™i3-12100F rappresenta unâ€™opzione conveniente per chi desidera giocare in Full HD senza esaurire il budget.In sintesi, se state cercando un processore economico ma capace, lâ€™Intel Core i3-12100F potrebbe essere la scelta giusta.",,,,,,,,,,,
Gran procesador y economico,5.0 out of 5 stars,"Va como un tiro, puedes jugar a maxima resoluciÃ³n con la grafica adecuada sin cuellos de botellaHe pasado de un i5 de sÃ©ptima generacion y la diferencia es abismal.",,,,,,,,,,,
qualitÃ© au top,5.0 out of 5 stars,Super processeur autant pour le gaming que le reste! couplÃ© a une rx 6750xt c'est au top tous les jeux tourne a fond il a une super cadence et ne chauffe pas de trop avec un bon ventirad acheter a part .possibilitÃ© de l'oc en BCLK mais pas tentÃ© j'en suis dÃ©jÃ  trÃ¨s satisfait.,,,,,,,,,,,
Mega guter Prozessor fÃ¼r 1080p Gaming - Zugreifen -,5.0 out of 5 stars,"Dieser Prozessor bietet exzellente Gaming Performance fÃ¼r sehr wenig Geld - der 12100F hat sogar eine hÃ¶here Singlethread Leistung als ein AMD Ryzen 3700X, und das ist angesichts des geringen Preises brachial gut (siehe Screenshot) - den mit ner RTX 3050 oder 6500 XT gepaart und man hat ein top Budget Gaming System fÃ¼r den schmalen Taler mit sehr viel Leistung fÃ¼r 1080p Gaming.Da kann ich nur raten: Zugreifen solange er noch gÃ¼nstig ist !",,,,,,,,,,,
The price.,5.0 out of 5 stars,It's fantastic for its price range for a beginner build and how it performs well for a budget CPU.,,,,,,,,,,,
Gute LÃ¶sung fÃ¼r low Budget Pc,5.0 out of 5 stars,LÃ¤uft bis jetzt stabil.,,,,,,,,,,,
I cannot comprehend how high performance these are,5.0 out of 5 stars,They perform better than even the 10th Gen i9. Itâ€™s absurd how well the current i3s perform when compared to high end chips from even two years ago.,,,,,,,,,,,
Ottimo processore,5.0 out of 5 stars,"mi sono imbattuto nel processore Intel Core i3-12100F e sono rimasto piacevolmente sorpreso dalla sua potenza e versatilitÃ .Prima di tutto, devo sottolineare la fluiditÃ  delle prestazioni.Grazie alla sua architettura moderna e ai quattro core fisici, il i3-12100F gestisce senza problemi tutte le attivitÃ  quotidiane, dalle sessioni di navigazione web alle sessioni di gioco piÃ¹ impegnative.Ho notato un netto miglioramento nelle prestazioni rispetto al mio vecchio processore, specialmente in applicazioni multithreading.Una delle cose che ho apprezzato di piÃ¹ Ã¨ stata l'affidabilitÃ .Il i3-12100F si Ã¨ dimostrato stabile anche sotto carichi di lavoro intensi, senza surriscaldamenti e senza compromettere le prestazioni.Questo mi ha dato la tranquillitÃ  necessaria per concentrarmi sul mio lavoro senza dover preoccuparmi di improvvisi rallentamenti o crash del sistema inoltre, devo menzionare la sua efficienza energetica.",,,,,,,,,,,
Fabuleux,5.0 out of 5 stars,"Ce processeur propose un rapport prix / performance incroyable. Il est aussi puissant que mon ancien 11700KF en simple coeur, et 20% plus lent seulement en multi-coeurs ! J'obtienais 2236/10151 avant (SC/MC) et maintenant 2231/8153 sur Geekbench 6. J'ai Ã©tÃ© trÃ¨s Ã©tonnÃ©, Ã  l'usage je n'ai presque pas vu la diffÃ©rence en passant du 11700KF/Z590 au 12100F/Z790, exceptÃ© pour les travaux multi-tÃ¢ches professionnels lourds. A ce prix lÃ  c'est vraiment impressionnant.",,,,,,,,,,,
potencia bruta por tan poco,5.0 out of 5 stars,"Siendo i3, se mea a otras generaciones anteriores debido a su alto IPC, y en juegos se nota. Rinde como un 10400, en juegos que pida mucho ipc, esta por encima de este.Tiene un precio bajo por el rendimiento que tiene pero tiene algo malo : las placas, son caras hasta la mas mierd*.De todos modos, lo recomiendo. la verdad. Si intel baja el precio de las placas, lo petan.",,,,,,,,,,,
Top! Chegou muito rÃ¡pido,5.0 out of 5 stars,"Veio processador e ventoinha, excelente custo benefÃ­cio",,,,,,,,,,,
Einfach nur Gut,5.0 out of 5 stars,HÃ¤lt was Beschrieben ist,,,,,,,,,,,
Ideal for Budget gaming,5.0 out of 5 stars,Great CPU for the price.,,,,,,,,,,,
Perfecto,5.0 out of 5 stars,Va sÃºper bien para el precio que tiene,,,,,,,,,,,
"Funcionando, entregue no prazo, bom prazo de entrega. Muito feliz, obrigado.",5.0 out of 5 stars,"Achar um fornecedor com prazo de entrega curto, muito bom.",,,,,,,,,,,
"bonne petite cpu,",5.0 out of 5 stars,"mtn un peu vieux , mais bien pour systeme debutant",,,,,,,,,,,
Ottimo prodotto (ricordatevi che serve una scheda video)!,5.0 out of 5 stars,"Intel da sempre offre prodotti di elevata qualitÃ  e questo i3 ne Ã¨ un'ulteriore dimostrazione! Svolge il proprio lavoro egregiamente. Ottimo rapporto qualitÃ /prezzo.Nella confezione Ã¨ presente il dissipatore con ventola e lo sticker ""Core i3"". Come per tutti i processori Intel ""F"" necessitÃ  di essere accompagnato da una scheda video dedicata!",,,,,,,,,,,
IdÃ©al pour les jeux et le multimÃ©dia.,5.0 out of 5 stars,"Cette 12Ã¨me gÃ©nÃ©ration de processeurs Intel est dÃ©cidÃ©ment excellente !Depuis 20 ans, je n'avais achetÃ© que du AMD, mais Ã  le lecture de nombreux tests qui avaient mis en avant les qualitÃ©s du 12100F, j'avais donc dÃ©cidÃ© de franchir le pas.Au dÃ©part, je voulais un processeur Ã  la fois suffisamment puissant dans les jeux, et qui ne chauffe pas (et donc qui ne consomme pas). DÃ©jÃ  parce qu'il Ã©tait destinÃ© Ã  Ãªtre placÃ© dans un HTPC, ayant par essence un airflow un peu compliquÃ©, et ensuite car je souhaitais optimiser le rapport performances/Ã©nergie.Je pense que c'est mission accomplie. En lecture de films, ou pendant l'Ã©coute de musique, le processeur Intel et la carte graphique (GTX 1660 TI)  ne dÃ©passent pas chacun les 35Â°c, et grimpent respectivement Ã  47Â°c et 62Â°c lors des sessions de jeux.Je prÃ©cise que le 12100F est refroidi par un ventirad Low Profile Noctua NHL-12S, appuyÃ© par un ventilateur Arctic P12, et est fixÃ© au socket par un cadre d'ajustement, sensÃ© Ã©viter les dÃ©formations de la surface du processeur, de marque Thermalright.En terme de puissance, ce processeur peut-Ãªtre associÃ© Ã  n'importe quelle carte graphique sans limiter le potentiel de cette derniÃ¨re, sauf peut-Ãªtre celles au-dessus des trÃ¨s puissantes AMD RX 6900 XT et des RTX 3080 TI.En applicatif en revanche, l'Intel pÃªchera un peu sans pour autant Ãªtre ridicule. Sachez qu'elle a autant de rÃ©pondant qu'un haut de gamme d'il y a 4 ans.Pour rÃ©sumer, au regard du prix, le 12100F est ce qu'il se fait de mieux pour un ordinateur destinÃ© Ã  un usage polyvalent et Ã©conomique.",,,,,,,,,,,
Bom,5.0 out of 5 stars,Bom,,,,,,,,,,,
Bloody amazing,5.0 out of 5 stars,10/10 buy now !!!!,,,,,,,,,,,
Schneller als ein 10400f,5.0 out of 5 stars,"Wenn die 4 Kerne reichen + dem Hyperthreading ist es schneller als ein 6 Kerner der vorletzten Generation.SpeicherunterstÃ¼tzung ist Top und sparsam ist er obendrein.Guter 4 Kerner, Preis noch etwas hoch jetzt am Anfang, aber das Pendelt sich ein.Beiligender KÃ¼hler ist absolut ausreichen und nicht zu hÃ¶ren.Alles Bestens",,,,,,,,,,,
Ã“timo para quem quer gastar pouco e jÃ¡ tem placa de vÃ­deo,5.0 out of 5 stars,O melhor custo-benefÃ­cio,,,,,,,,,,,
Ottimo,5.0 out of 5 stars,"Gran bel processore entry level, poco energivoro ma comunque buone prestazioni",,,,,,,,,,,
Melhor custo benefÃ­cio,5.0 out of 5 stars,Top,,,,,,,,,,,
"Reliable, fast and efficient",5.0 out of 5 stars,"Pretty cool in terms of temperature, powerful due to new architecture and reliable. Works more than a month in pair with an RTX 2060. No problems occurred during this time, I truly recommend.",,,,,,,,,,,
Bon produit,5.0 out of 5 stars,L'emballage realiser par Amazon laisse Ã  dÃ©sirer pour des produit de ce type. cependant le produit fonctionne parfaitement les performances sont au rendez vous ! Le ventirad fournit suffit pour le refroidir je ne suis pas monter Ã  plus de 60Â°. TrÃ¨s bon processeur pour du gaming,,,,,,,,,,,
95 euro spesi bene,5.0 out of 5 stars,"Ci hanno insegnato che i processori i3 non sono adatti a videogiocare, sono passato da un i5 4440 a questo. un bel salto avanti in termini di prestazioni. riesce a tenere il passo con tutti i giochi di nuova generazione ad un prezzo piÃ¹ che ottimo, non spenderei mai 347 per un i7 di 12Â° generazione ne 472 per un i9, sono felice di aver speso solo 1/4",,,,,,,,,,,
Processeur,5.0 out of 5 stars,Bien,,,,,,,,,,,
Excelente,5.0 out of 5 stars,VelocitÃ  ecepcionale,,,,,,,,,,,
TrÃ¨s bon CPU,5.0 out of 5 stars,"J'ai pris ce CPU aprÃ¨s avoir vu les tests qui sont vraiment impressionnant pour cette gamme. Pris pour faire une petite config de jeu style Roblox pour un enfant, Ã§a passe Ã  l'aise et je sais qu'elle pourra le garder quelques annÃ©es encore.",,,,,,,,,,,
intel i3-12100f,5.0 out of 5 stars,prodotto originale spedito in tempi brevi. ottimo processore per utilizzo in ambito office e grafica.,,,,,,,,,,,
I3,5.0 out of 5 stars,"Cosa dire? Best buy! Un piccolo missile ad un prezzo zero! Questo processore Ã¨ indicato per build fhd e 1440p con abbinamento di una discreta GPU dedicata. Io lo uso tutti i giorni, funziona benissimo. Testato con il PC di mio fratello questo i3 strappa qualche fps in piÃ¹ confronto al 5600x su PC di mio fratello. (Stessa GPU e ram) non scalda nulla e consuma pochissimo. Quindi bastano alimentatori non esagerati, e dissipatore enormi. 4 core fisici e 4 virtuali. Ottimo per tutto. Consigliato al 100% per build da 700/1000â‚¬",,,,,,,,,,,
Entrega,5.0 out of 5 stars,"Produto entregue rapidamente pelos Correios, bom vendedor, recomendo.",,,,,,,,,,,
Petite Bombe !,5.0 out of 5 stars,"Excellent processeur pour le gaming au budget restreint.TrÃ¨s sous-estimÃ©, le i3-12100 est la petite ""GTI"" des processeurs.C'est Le meilleur rapport qualitÃ©/prix pour de l'entrÃ©e de gamme.Excellent rapport conso/chauffe/perf.Les performances sont les mÃªmes que ses homologues en i5/i7 et r5/r7 lorsque coupÃ©e avec un GPU milieu de gamme.Elle n'a rien a envier, sauf si vous avez une centaine d'euros Ã  mettre en plus sur un i5-12400 ou un r5-5600",,,,,,,,,,,
I3 con le p*lle quadrate,5.0 out of 5 stars,"Sorprendente i3, poca spesa e tanta resa. Ho assemblato un pc da zero partendo da lui, un grande salto in avanti dal mio vecchio Phenom II x4. Tanti lamentano che sia un i3, collo di bottiglia futuro e bla bla bla. Se volete spendere di piÃ¹ fatelo, ma questo regge tranquillamente ogni titolo attuale, costa poco ed Ã¨ nuovo. Rapporto qualitÃ -prezzo eccezionale.",,,,,,,,,,,
Ottimo compromesso,5.0 out of 5 stars,"In questo periodo storico dove i prezzi sono andati alle stelle, chi vuole giocare a computer senza pretese ha ben poche opzioni. Questo processore Ã¨ un buon candidato. Purtroppo se si passa ad editing video o streaming a livello medio alti, comincia a rallentare, ma dopotutto Ã¨ pur sempre un i3, progettato per un uso casalingo.",,,,,,,,,,,
nickel,5.0 out of 5 stars,trÃ¨s bon processeur ; ne chauffe pas .parfait et rapide.,,,,,,,,,,,
Intel Core i3-12100F,5.0 out of 5 stars,"Un bel processore, montato su una MSI PRO H610M-B DDR4 va alla grande, anche se mi aspettavo di meglio rispetto al suo predecessore I3 10100F .Comunque tutto ok, anche la consegna !",,,,,,,,,,,
un bijou pour le gaming,5.0 out of 5 stars,montÃ© sur CM Msi mag mortar Max b660m.... overclockÃ© Ã  plus de 5Ghz... niveau perf/prix y a pas mieuxje prÃ©cise que c'est un processeur destinÃ© au gaming,,,,,,,,,,,
proceseur gaming,5.0 out of 5 stars,"Le meilleur processeur gaming pour petit budget, un monstre de puissance pour a peine 100â‚¬, si vous comptez vous monter une machine pour pas cher c'est le must have, au delÃ  d'une RX 6600 XT ce CPU va brider votre carte graphique en 1080p mais a plus haute resolution sera tout de mÃªme extrÃªmement efficace comparÃ© aux processeur de gamme supÃ©rieure.",,,,,,,,,,,
Bon pour mettre a jour une z690,5.0 out of 5 stars,TrÃ¨s bon processeur pour mettre a jour une z690 a moindre cout sinon c'est totalement obsolÃ¨te.,,,,,,,,,,,
Guter Kauf!,5.0 out of 5 stars,Habe die CPU fÃ¼r einen Office-PC gekauft. FÃ¼r diesen Zweck absolut in Ordnung.,,,,,,,,,,,
Performances etonnantes !,5.0 out of 5 stars,"Jâ€™ai achetÃ© ce CPU pour renouveler mon PC de bureau, Ã  vocation multimÃ©dia et jeux genre Diablo ou Starcraft .Et bien â€¦ quelle ne fut pas ma surprise quand jâ€™ai vu quâ€™il Ã©tait aussi rapide en jeux que le 3700x de mon simulateur de pilotage ! Une vraie fusÃ©e pour un prix ridicule.",,,,,,,,,,,
Best buy 2022,5.0 out of 5 stars,"Il processore piÃ¹ economico del 2022, ma che si comporta benissimo in game, l'ho associato con una RTX 3060 Ti e non mi posso lamentare.. i 240 fps per i monitor a 240hz li supera e li mantiene in modo eccellente.",,,,,,,,,,,
ottimo,5.0 out of 5 stars,bella cpu,,,,,,,,,,,
Super produit,5.0 out of 5 stars,"AchetÃ© pour mon frÃ¨re il en est trÃ¨s content, utilisation spÃ©cialement pour du gaming ( elles ring, Overwatch, dying light 2...)Je recommande. Le ventirad est joli aussi.",,,,,,,,,,,
"Gutes Teil, Klasse Preis/Leistung",5.0 out of 5 stars,Als Upgrade vom einen i5 4. Generation.Funktioniert tadellos.,,,,,,,,,,,
"Intel Processeur Core i3-12100F Alder Lake-S (3,3Ghz) (sans iGPU)",5.0 out of 5 stars,petit processeur ultra douÃ© qui permet de jouer ou de travailler sans jamais Ãªtre en dÃ©fautpour le prix il ne faut pas hÃ©siter .A noter que la prochaine gÃ©nÃ©ration de processeur Intel utilisera le mÃªme socket LGA 1700,,,,,,,,,,,
Surpris,5.0 out of 5 stars,"Alors on pourrait dire que un I3 c'est bof,mais il a vraiment une sacrÃ© puissance. Fait tournÃ© des jeux comme ciberpunk avec une rx6600 on 60fps 1080p. I3 sur papier mais la puissance d'un I5 recommande si petit budget",,,,,,,,,,,
Amazing!,5.0 out of 5 stars,"Runs like a beast , havenâ€™t had any noticeable issues so far.",,,,,,,,,,,
Processeur idÃ©al rapport qualitÃ©/prix,5.0 out of 5 stars,"Ce petit processeur est vraiment surprenant. Pour son prix, les performances sont au rendez-vous. IdÃ©al pour une configuration gaming entrÃ©e de gamme. Je recommande ce produit et le vendeur.",,,,,,,,,,,
Super Gamer CPU.,5.0 out of 5 stars,"Mega CPU, in Games mit RTX3080 schneller als ein 10900 non K!",,,,,,,,,,,
Bon produit,5.0 out of 5 stars,Bonne qualitÃ© envoi rapide,,,,,,,,,,,
Sensacional,5.0 out of 5 stars,"Recebi com rapidez. Tudo certo com o produto. Novo. Veio cooler, e aplicaÃ§Ã£o de pasta termica no dissipador. Aparentemente tudo ok. Ainda nÃ£o testei. Estou aguardando outras peÃ§as. Recomendo.",,,,,,,,,,,
TrÃ¨s bon rapport qualitÃ© prix,5.0 out of 5 stars,UtilisÃ© en pchc avec une 3070 rtx.Parfait pour le prix,,,,,,,,,,,
Rapport qualitÃ© prix performance extra !,5.0 out of 5 stars,Pour le petit prix du i3-12100f juste parfait et trÃ¨s stable et puissant ! (Principalement utilisÃ© gamging),,,,,,,,,,,
Ottimo per un utilizzo quotidiano leggero,5.0 out of 5 stars,"Dissipatore fornito molto silenzioso. Performance adatte ad un utilizzo da ufficio, o gaming e produzione leggeri",,,,,,,,,,,
Novo e lacrado! Ainda nÃ£o testei,5.0 out of 5 stars,Gostei que chegou novo e Lacrado!Muito bomAÃ­nda nÃ£o testei o produto!,,,,,,,,,,,
processador otimo custo beneficio,5.0 out of 5 stars,"O processador Ã© muito bom pelo valor, superou as espectativas.",,,,,,,,,,,
Bon qualitÃ© prix,5.0 out of 5 stars,Bon qualitÃ© prix,,,,,,,,,,,
"Super produits, livraison rapide",5.0 out of 5 stars,"Produits conformes, livraison rapide",,,,,,,,,,,
Processador de entrada!,5.0 out of 5 stars,,,,,,,,,,,,
Ottimo articolo,5.0 out of 5 stars,Ottimo articolo,,,,,,,,,,,
Rien a redire,5.0 out of 5 stars,Juste ventirade Ã  changer,,,,,,,,,,,
"1.0 out of 5 stars
Itâ€™s used and trash donâ€™t buy it",1.0 out of 5.0 out of 5 stars stars,When I got it the fan didnâ€™t have anything to protect the thermal paste it was just touching the cardboard box and the box looks like it survived ww2 it was trashed and the cpu is used I can see the marks on it from the socket definitely donâ€™t buy this one find another one or just go for AMD I wish I went for AMD but their ITX motherboard are expensive so I bought intel and I wish I didnâ€™t I really hate intel and I donâ€™t recommend it you can get better CPU from AMD for the same price or you can get the same cores and threads and still way cheaper so yeah I donâ€™t recommend intel or this exact product post,,,,,,,,,,,
"1.0 out of 5 stars
FAULTY",1.0 out of 5.0 out of 5 stars stars,Bro i donâ€™t know if they sent me a faulty cpu but my custom built pc wasnâ€™t turning on it would boot up but have no display in replacing my cpu and buying a new one I made sure everything is compatible with my motherboard and all my parts work i even went to a technician!! so Iâ€™ll keep you updated to see if the new cpu works,,,,,,,,,,,
"1.0 out of 5 stars
No cpu in box had clearly been stolen!",1.0 out of 5.0 out of 5 stars stars,Outer box was fine but opened up to find the intel box was clearly tampered with and security sticker broken and box already opened. Cpu was gone and only left with a useless cooler. Snatched by someone in the warehouse i guess sad times.,,,,,,,,,,,
"1.0 out of 5 stars
this is junk and can not get a refund do not buy",1.0 out of 5.0 out of 5 stars stars,it does not work,,,,,,,,,,,
"1.0 out of 5 stars
El procesador vino quemado",1.0 out of 5.0 out of 5 stars stars,,,,,,,,,,,,
Precisa ter placa de vÃ­deo externa.,2.0 out of 5 stars,NÃ£o possui controladora de vÃ­deo. Isso nÃ£o permite a utilizaÃ§Ã£o de placas de vÃ­deos onboard. NÃ£o estÃ¡ bem claro isso no produto em venda.,,,,,,,,,,,
ä¸­èº«ãŒé•ã†ã‚‚ã®ãŒå±Šã„ãŸ,2.0 out of 5 stars,intel PENTIUM GOLD G6405 LGA1200ã®å¤–ç®±ã«ã€Œã‚¤ãƒ³ãƒ†ãƒ«INTEL CPU Core...512400Fã€å›½å†…æ­£è¦æµé€šå“ã€‘æ–°å“ã€ã¨æ›¸ã‹ã‚ŒãŸãƒãƒ¼ã‚³ãƒ¼ãƒ‰ã‚·ãƒ¼ãƒ«ãŒè²¼ã‚‰ã‚Œã¦ã„ã‚‹ã‚‚ã®ãŒå±Šã„ãŸã€‚ä¸­èº«ãŒå…¨ãé•ã†ãŸã‚ã€ãƒãƒ¼ã‚³ãƒ¼ãƒ‰ã‚·ãƒ¼ãƒ«ã®è²¼ã‚Šä»˜ã‘ãƒŸã‚¹ã ã¨æ€ã‚ã‚Œã‚‹ãŒã€ä¸€çž¬è©æ¬ºã‹ã¨æ€ã£ãŸã€‚è¿”å“ã¯å•†å“è¿”é€å¾Œè¿”é‡‘ã§ã€äº¤æ›ã§ã¯ãªã„ãŸã‚åˆ¥é€”è³¼å…¥ã™ã‚‹å¿…è¦ãŒã‚ã‚Šé¢å€’ã€‚å¿µã®ãŸã‚é•ã†åº—ã‹ã‚‰è³¼å…¥ã¨ã—ãŸã€‚æœªé–‹å°ã ãŒè¿”é€å¾Œãã¡ã‚“ã¨å¯¾å¿œã—ã¦ã‚‚ã‚‰ãˆã‚‹ã®ã‹ç”šã ä¸å®‰ã€‚,,,,,,,,,,,
ã‚¯ãƒ¼ãƒ©ãƒ¼ãƒ•ã‚¡ãƒ³ã®ãƒã‚¸ãŒæœ€æ‚ªã®è¨­è¨ˆ,2.0 out of 5 stars,ãƒ•ãƒ¼ãƒ©ãƒ¼ãƒ•ã‚¡ãƒ³ãŠãƒã‚¸ãŒãƒ—ãƒ©ã‚¹ãƒãƒƒã‚¯ã§ã€ã™ã”ãã‚ã‹ã‚Šã«ãã„ã€ã‚‚ã†ã—ãã¯ã—ã£ã‹ã‚Šã¨å›ºå®šã§ããªã„ã‚ˆã†ãªãƒã‚¸ã§ã™ã€‚åŒå°ã—ã¦ã„ã‚‹ãƒ•ã‚¡ãƒ³ã®ãƒã‚¸ã§ã‚¯ãƒ¼ãƒ©ãƒ¼ãŒCPUã«ãƒ”ãƒƒã‚¿ãƒªã¨ãã¤ã‹ãªã„ã§ã™ã€‚,,,,,,,,,,,
"2.0 out of 5 stars
They lied about the free games",2.0 out of 5 stars,It works but they lied about giving two free games.,,,,,,,,,,,
"2.0 out of 5 stars
Damaged packaging, possibly used product.",2.0 out of 5 stars,Came with damaged box and the factory security seal already broken. Returned and will be ordering from elsewhere.,,,,,,,,,,,
"2.0 out of 5 stars
Failed 2 months after getting it.",2.0 out of 5 stars,"A disappointment. Crashed repeatedly in the first month, but I gave it the benefit of doubt. I should've just send it back, what a bummer. Finally failed after under 2 months of struggle. Got no value out of it, unfortunately.",,,,,,,,,,,
"2.0 out of 5 stars
BUYER BEWARE !",2.0 out of 5 stars,"This CPU does not support integrated Graphics and requires a Video card to function, this seller has deliberately omitted the warning, you will need to buy a good video card at a high additional cost.",,,,,,,,,,,
La boites semble arriver de faire la guerre,2.0 out of 5 stars,LivrÃ© dans une boite trÃ¨s endomagÃ©e je n'ai pas encore eu le temp de l'installer.. j'espÃ¨re vraiment que le processeur n'est pas endomagÃ©... je vais mettre plus d'infos dÃ¨s que j'en ai...,,,,,,,,,,,
"3.0 out of 5 stars
broken blade",3.0 out of 5 stars,A blade of the fan was broken when arrive its was thrown into the box (it was used),,,,,,,,,,,
"3.0 out of 5 stars
CPU OK--Cooler is Worthless",3.0 out of 5 stars,So far the CPU works as expected.  The included Intel CPU cooler is completely useless.  The installation process is obscure and the mounting system is terrible.  Basically plastic pop rivets which hold the fan to the motherboard.  The cooler did not work and the CPU temperature was almost 90 C.  The motherboard would not let me load software because of the high temperature warning.  I replaced the Intel unit with an after market cooler that works very well.  CPU temperature in now in the mid 20's.  A very disappointing experience and I think that I will use AMD processors next time.,,,,,,,,,,,
"3.0 out of 5 stars
I would've liked a fan",3.0 out of 5 stars,"So when i got the cpu it was in a brown box with bubble wrap around it. it looks fine, but i didnt get a fan and the lack of official packaging is kinda off putting  i think the cpu is great, just buy it from a different seller.",,,,,,,,,,,
"3.0 out of 5 stars
Sold above Manufactures Suggested Retail Price",3.0 out of 5 stars,"It's a great gaming CPU but selling above Manufactures Suggested Retail Price is taking advantage of the consumer during tough times.This I'll never forget once the demand on electronics ends, then they'll be giving this stuff away,,,",,,,,,,,,,,
"3.0 out of 5 stars
Ok",3.0 out of 5 stars,Was good but I ended up getting a i7,,,,,,,,,,,
"3.0 out of 5 stars
Never hits 4.4ghz",3.0 out of 5 stars,"Just a heads up, this CPU never goes above 3.9ghz. Itâ€™s still a good CPU but itâ€™ll bottleneck.",,,,,,,,,,,
"4.0 out of 5 stars
EstÃ¡ bien",4.0 out of 5 stars,"EstÃ¡ bien, ha cumplido su funciÃ³n sin ningÃºn problema, solo que el disipador apesta.",,,,,,,,,,,
"4.0 out of 5 stars
It has good electrical consumption for its performance, the price also helps",4.0 out of 5 stars,"The stock temperature dissipator is not the best, it can easily reach (80Â°C / 176Â°F)The packaging was somewhat damaged.",,,,,,,,,,,
