title,rating,review,,,,,,,,
Damaged packaging,1.0 out of 5 stars,The CPU was shipped in a bubble wrap envelope. I am unsure if the damage occurred in transit or before shipping.,,,,,,,,
Review,1.0 out of 5 stars,"I liked how it was so fast with Windows ten, but I didn't like the fact that it couldn't handle simple tasks.",,,,,,,,
Ruined My Gaming Experience,1.0 out of 5 stars,It lags my Discord calls when I'm gaming. I started to lag everything when I start gaming. It also makes my system crash frequently.,,,,,,,,
Bad and terrible CPU!!!,1.0 out of 5 stars,This is bad and should not be bought!!!! Go buy the one from Amazon because this one is just dumb and useless.,,,,,,,,
Confirm the investigation before adding a comment. Let's make a sigh at the missed comments.,1.0 out of 5 stars,"This product (Core i3-9100f LGA1151) was insufficient for my needs and could not be used in my custom-built PC. My motherboard (ASUS H170-PRO) is from the 4th generation, so this product is incompatible.",,,,,,,,
Good and bad,1.0 out of 5 stars,"CPU is good, but dealing with the buyer was bad.",,,,,,,,
Broken seal removed?,1.0 out of 5 stars,The seal on the box was broken before I opened it. There was brownish powder-like dirt on the seal. This is a problem before evaluation.,,,,,,,,
Trash processor,1.0 out of 5 stars,"Can't handle anything, do not buy.",,,,,,,,
Buyer beware,1.0 out of 5 stars,"Expected a new item, but this box was already opened. I'm not pleased...",,,,,,,,
AVOID for anything other than light work,1.0 out of 5 stars,"Very bad processor. Lack of hyper-threading killed it. Get the 10th gen i3 instead, worth it.",,,,,,,,
I DID NOT GET MY REFUND,1.0 out of 5 stars,"Complete piece of crap, and never got my refund.",,,,,,,,
Used - Already Opened,1.0 out of 5 stars,Used. Unsealed box. Missing fan. Thermal paste already on it.,,,,,,,,
DOA,1.0 out of 5 stars,Product was dead on arrival.,,,,,,,,
It reach and it was no good,1.0 out of 5 stars,"It arrived, and it was no good.",,,,,,,,
